location,source,target,id,fuzzy,context,translator_comments,developer_comments
Scripts/content/Story/Log_Constants.d:479,"Am Hintereingang des Alten Lagers fing mich Diego ab und warnte mich vor tiefgreifenden Ereignissen, die sich jüngst zugetragen haben.",在旧营地的后门，迪哥拦阻了我，告诉了我已经发生了的严重事件。,,,CH4_Firemages_2,,
Scripts/content/Story/Log_Constants.d:480,"Nach dem Einsturz der Alten Mine hat Gomez seinen Männern befohlen, einen Angriff auf die Freie Mine des Neuen Lagers zu unternehmen. Als sich Corristo und seine Feuermagier dem Plan wiedersetzten, wurden sie von Gomez Männern hinterrücks niedergestreckt.",旧矿坑塌方后，葛梅兹命令他的人去袭击新营地的自由矿坑。由于克里斯托和火界\n法师们反对这个计划，所以他们被葛梅兹的人杀害了。,,,CH4_Firemages_3,,
Scripts/content/Story/Log_Constants.d:481,Ich muß so schnell wie möglich das Neue Lager warnen und Saturas über die Ereignisse aufklären. Hoffentlich komme ich nicht zu spät.,我必须尽快去新营地通知沙图拉斯此次事件。我希望不会太迟。,,,CH4_Firemages_4,,
Scripts/content/Story/Log_Constants.d:482,"Saturas, Anführer der Wassermagier, hat einen letzten Gefallen von mir gefordert. Er benötigt für die Sprengung des Erzhaufens die Hilfe der Feuermagier aus dem Alten Lager. Ich weiß noch nicht, wie ich Gomez' Magier überreden soll, an einem Plan mitzuwirken, der das Ende ihrer Machtgrundlage bedeuten würde, aber mir wird schon was einfallen.",水界法师的领导沙图拉斯，要求我帮他最后一个忙。他要求，帮助旧营地的火界法\n师炸掉矿石堆。我不知道，怎样说服葛梅兹的界法师们参与这个计划，但是我会尽\n力想办法的。,,,CH4_Firemages_5,,
Scripts/content/Story/Log_Constants.d:483,Die Tore des Alten Lagers sind nun verschlossen und werden von Gardisten bewacht. Sie attackieren jeden der dem Lager zu nahe kommt.,现在，旧营地的大门已经关了，它们都有守卫把守。他们向任何一个接近营地的人\n袭击。,,,CH4_Firemages_6,,
Scripts/content/Story/Log_Constants.d:484,"Saturas war garnicht erfreut, als ich ihm über die Ereignisse im Alten Lager berichtet habe. Wie immer es jetzt mit der Sprengung der magischen Barriere weitergeht... es wird auf jeden Fall OHNE die Feuermagier geschehen müssen.",当我把旧营地发生的事，告诉了沙图拉斯时，他并不高兴。无论是什么事影响了他\n们的逃跑计划．．．他们都不需要火界法师的插手。,,,CH4_Firemages_8,,
Scripts/content/Story/Log_Constants.d:485,"Wie Diego, so hält auch Milten sich in der Nähe des Alten Lagers versteckt. Der Feuermagier warnt in sicherer Entfernung vor dem Haupttor Ankömmlinge, damit sie nicht den Gardisten in die Hände fallen.",正如迪哥一样，米尔顿正藏在旧营地的附近。在靠近大门的安全距离内，火界法师\n警告到那里的人，所以，他们就不会落入守卫们的手中了。,,,CH4_Firemages_9,,
Scripts/content/Story/Log_Constants.d:486,"Nachdem mir Diego von den unglaublichen Ereignissen berichtet hat, traf ich auch Milten auf der Vorderseite des Alten Lagers. Hoffentlich lassen sich die beiden nicht erwischen.",在迪哥告诉了我这不可思议的事情后，我在旧营地的前面遇到了米尔顿。我希望他\n们不会被抓住的。,,,CH4_Firemages_10,,
Scripts/content/Story/Log_Constants.d:487,Milten fing mich vor dem Alten Lager ab und berichtete mir vom Einsturz der Alten Mine und der Ermordung der Feuermagier.,米尔顿在旧营地的前面拦住了我，告诉我旧矿坑塌方了，火界法师们都被杀害了。,,,CH4_Firemages_11,,
Scripts/content/Story/Log_Constants.d:488,"Diego hält sich auf der anderen Seite des Alten Lagers in der Nähe des hinteren Tores auf. Ich soll unbedingt mit ihm sprechen, denn er weiß mehr über die Ereignisse.",迪哥呆在旧营地的另一面，后面的大门的附近。我应该去找他谈谈，他知道的情况\n会更多。,,,CH4_Firemages_12,,
Scripts/content/Story/Log_Constants.d:490,Das Treffen,会议,,,CH4_4Friends,,
Scripts/content/Story/Log_Constants.d:491,"Ich habe Lester und Gorn nun darüber informiert sich mit den anderen beiden Freunden zu treffen. Ab jetzt ist dies nicht mehr meine Angelegenheit. Sie werden schon wissen, was zu tun ist.",我已经把遇到宫尔和莱斯特的朋友的事，告诉了他们。现在，这不再是我的事了。\n他们会知道下一步该如何做．．．,,,CH4_4Friends_1,,
Scripts/content/Story/Log_Constants.d:492,"Alle Feuermagier sind tot und die Situation spitzt sich zu. Diego hat mich beauftragt Lester und Gorn davon zu unterrichten, daß er sich mit Ihnen und Milten an einem geheimen Ort treffen will. Das scheinen sie nicht zum ersten gemacht zu haben.",所有的火界法师都死了。形势已经超出了控制。迪哥想让我告诉莱斯特和宫尔，让\n他们与他和米尔顿在一个秘密的地方会面。他们似乎不是第一次秘密会面！,,,CH4_4Friends_3,,
Scripts/content/Story/Log_Constants.d:494,Verbannung aus dem Alten Lager,从旧营地放逐,,,CH4_BannedFromOC,,
Scripts/content/Story/Log_Constants.d:495,"Bloodwyn, hat sich am hinteren Tor verschanzt. Er reagierte ähnlich wie Fletcher am Haupttor. Mir ist nicht klar warum, aber es muss etwas mit meiner Fokussuche für das Neue Lager zu tun haben.",布罗德恩在后面的大门附近。他和在主大门的弗雷契的反应一样。我不知道这是为\n什么，但是它一定与我代表新营地利益的探索有关。,,,CH4_BannedFromOC_1,,
Scripts/content/Story/Log_Constants.d:496,"Fletcher, der nun mit einer Gruppe Gardisten am Haupttor des Alten Lagers Wache hält, bezeichnete mich als Verräter und Abtrünniger. Er lies sich auf keine Diskussion ein und griff mich sofort an!",布罗德恩和一群守卫守卫在旧营地的后面的大门。他说我是一个叛徒，一个叛国者。\n他不听我解释，就马上袭击我！,,,CH4_BannedFromOC_2,,
Scripts/content/Story/Log_Constants.d:497,"Es sieht so aus, als ob ich nun aus dem alten Lager verbannt wurde!",看起来，我像是已经被旧营地驱逐了！,,,CH4_BannedFromOC_3,,
Scripts/content/Story/Log_Constants.d:498,"Fletcher, der nun das Haupttor bewacht, reagierte ähnlich wie Bloodwyn am hinteren Tor. Mir ist nicht klar warum, aber es muss etwas mit meiner Fokussuche für das Neue Lager zu tun haben.",弗雷契现在正守护着主大门，他的反应和后面的大门的布罗德恩一样。我不知道这\n是为什么，但是它一定与我代表新营地利益的探索有关。,,,CH4_BannedFromOC_4,,
Scripts/content/Story/Log_Constants.d:499,"Bloodwyn, der nun mit einer Gruppe Gardisten am hinteren Tor des Alten Lagers Wache hält, bezeichnete mich als Verräter und Abtrünniger. Er lies sich auf keine Diskussion ein und griff mich sofort an!",布罗德恩和一群守卫守卫在旧营地的后面的大门。他说我是一个叛徒，一个叛国者。\n他不听我解释，就马上袭击我！,,,CH4_BannedFromOC_5,,
Scripts/content/Story/Log_Constants.d:500,Nachdem ich aus dem Alten Lager verbannt wurde hat mich Saturas im Neuen Lager wilkommen geheissen.,旧营地把我驱逐出来后，沙图拉斯欢迎我加入新营地。,,,CH4_BannedFromOC_7,,
Scripts/content/Story/Log_Constants.d:501,"Lee, der Anführer der Söldner, will in dieser Angelegenheit mit mir sprechen. Ich soll ihn aufsuchen und anschließend wieder zu Saturas zurückkehren.",佣后的头领黎翌想找我说我。我要去见见他，然后再返回沙图拉斯身边。,,,CH4_BannedFromOC_8,,
Scripts/content/Story/Log_Constants.d:502,"Saturas bot mir an, mich in den Kreis der Wassermagier aufzunehmen, ohne dass ich meinen alten Schwur des Feuers brechen muss.",沙图拉斯将允许我加入水界法师，而不必违背火界法师的誓言。,,,CH4_BannedFromOC_9,,
Scripts/content/Story/Log_Constants.d:503,Er hat mich in den Kreis der Wassermagier aufgenommen. Von nun an habe ich Zugriff auf beide Schulen der Magie.,现在，我已经加入了水界法师。从现在起，我要拥有了两种魔法能量。,,,CH4_BannedFromOC_10,,
Scripts/content/Story/Log_Constants.d:504,Auch Saturas hat mich nun als neuer Söldner offiziell begrüßt.,沙图拉斯现在已经正式允许我成为了一名佣兵。,,,CH4_BannedFromOC_11,,
Scripts/content/Story/Log_Constants.d:505,Ich habe Lee über Gorns und mein Aufräumen in der freien Mine informiert. Er zeigte sich sehr zufrieden.,我把此次行动告诉了黎翌，宫尔和我已经在自由矿坑里完成了任务。他非常高兴。,,,CH4_BannedFromOC_12,,
Scripts/content/Story/Log_Constants.d:506,"Ich habe die Seiten gewechselt. Nachdem das alte Lager mich verbannt hat, habe ich mich nun den Söldnern angeschlossen. Nun wieder zurück zu Saturas!",我叛变了。在旧营地驱逐出我以后，我就加入了佣兵。现在，我要返回沙图拉斯\n身边。,,,CH4_BannedFromOC_13,,
Scripts/content/Story/Log_Constants.d:508,Xardas der Dämonenbeschwörer,巫师萨尔达斯,,,CH4_FindXardas,,
Scripts/content/Story/Log_Constants.d:509,"Ich habe alle drei Golemherzen an den Wächter-Dämon übergeben. Im Tausch erhielt ich eine Zauberrune der Teleportation. Mal sehen, wo sie mich hinbringt.",我已经把三个魔像的心脏交给了魔鬼守卫。作为交换，我收到了心灵传送的符石。\n让我们看看，它能带我去哪儿吧！,,,CH4_FindXardas_1,,
Scripts/content/Story/Log_Constants.d:510,"Ich habe beschlossen, Saturas NICHT zu erzählen, daß laut Xardas all die Jahre des Erzanhäufens umsonst waren. Sobald ich einen anderen Weg gefunden habe, die magische Barriere zu zerstören, werde ich ihm die ganze Wahrheit erzählen. Bis dahin werde ich die Schande auf mich nehmen, eine Mission nicht erfüllt zu haben.",我决定不告诉沙图拉斯，萨尔达斯这许多年来徒劳搜索的矿石的事了。只要我一找\n到毁坏魔法屏障的另一种方法，我就会告诉他整个事实。直到那时，我才不会生活\n在耻辱里。,,,CH4_FindXardas_2,,
Scripts/content/Story/Log_Constants.d:511,"Endlich habe ich Xardas getroffen. Doch die Begegnung verlief völlig anders als erwartet. Er interessierte sich überhaupt nicht für den Erzhaufen, sondern erzählte mir den ersten Teil der Historie des Schläfers. Ich bin nicht sicher, wie ich Saturas vom Verlauf dieses Gesprächs berichten soll.",以前，我遇到过萨尔达斯。但是那次相遇与我所期望的却不一样。他对矿石堆并不\n感兴趣，但他却告诉了我沈睡者的以前的一段故事。我不知道怎样和沙图拉斯说这\n次会面的过程。,,,CH4_FindXardas_3,,
Scripts/content/Story/Log_Constants.d:512,"Nach der Ermordung der Feuermagier bleibt nur noch EINER übrig, der die Sprengung des Erzhaufens ermöglichen kann. Saturas erzählte, daß die Erschaffung der magischen Barriere von einem 13. Zauberer geleitet wurde.",自从火界法师们被杀之后，只剩下一个人能帮助引爆矿石堆了。沙图拉斯告诉我，\n魔法屏障是由第十三位法师带领所创建的。,,,CH4_FindXardas_4,,
Scripts/content/Story/Log_Constants.d:513,"Dieser 13. Zauberer mit Namen Xardas lebt zurückgezogen in einem Turm mitten im Orkgebiet. Ich habe mich dazu bereiterklärt, ihn aufzusuchen und um Hilfe zu bitten.",第十三位法师的名字是萨尔达斯，他隐居在兽人地带中部，一座塔的右边。我要去\n那里，请求他的帮助。,,,CH4_FindXardas_5,,
Scripts/content/Story/Log_Constants.d:514,"Saturas warnte mich vor den magischen Kreaturen des Dämonenbeschwörers Xardas. In der Bibliothek der Wassermagier gibt es Schriften über die Gefahren und Schwächen solcher Wesen. Ich sollte mir etwas Zeit nehmen, um dort herumzustöbern.",沙图拉斯警告我，要小心巫师萨尔达斯的魔法生物。在水界法师的藏书室里，有关\n于这些生物的危险性及弱点的书籍。我应该抽空去那里看看。,,,CH4_FindXardas_6,,
Scripts/content/Story/Log_Constants.d:515,"In der Bibliothek der Wassermagier gibt es Schriften über die Gefahren und Schwächen solcher Wesen. Ich sollte mir etwas Zeit nehmen, um dort herumzustöbern.",在水界法师的藏书室里，有关于这些生物的危险性及弱点的书籍。我应该抽空去那\n里看看。,,,CH4_FindXardas_7,,
Scripts/content/Story/Log_Constants.d:516,"Im Inneren von Xardas' Turm begegnete ich einem Dämon, der in meinen Gedanken zu mir sprach. Er will drei Beweise für den Sieg über die Elemente Feuer, Eis und Stein, bevor er mich zu seinem Meister vorläßt.",在萨尔达斯的塔里我遇到了一个魔鬼，它和我直接过思想来交谈。它想要我通过火、\n冰和石头三种物质的考验。然后，我才能去见它的主人。,,,CH4_FindXardas_8,,
Scripts/content/Story/Log_Constants.d:518,Der verbannte Ork-Schamane,被放逐的兽人巫师,,,CH4_FindOrcShaman,,
Scripts/content/Story/Log_Constants.d:519,"Xardas will mich erneut auf die Probe stellen. Um den zweiten Teil der Schläfer-Geschichte zu erfahren, soll ich einen verbannten Ork-Schamanen in der Ruine eines Kastells aufsuchen. Es steht auf dem Gipfel eines hohen Berges im Osten von Xardas' Turm. Mir ist noch nicht ganz klar, wie ich den Schamanen davon abhalten kann, gleich Feuerbälle nach mir zu werfen. Kommt Zeit, kommt Rat.",萨尔达斯想再一次考验我。我要去一个废弃的城堡，听一个被驱逐的兽人巫师的话，\n他会告诉我沈睡者故事的第二部分。他在萨尔达斯塔东部的山峰上。也许他会向\n我投掷火球,,,CH4_FindOrcShaman_1,,
Scripts/content/Story/Log_Constants.d:520,"Ich habe den Ork-Schamanen mit Namen Ur-Shak vor der Wut seiner eigenen Stammesbrüder gerettet. Zum Dank dafür erzählte er mir den restlichen Teil der Schläfer-Geschichte. Nun kann ich zu Xardas zurückkehren, um meinen Auftrag zu erfüllen.",我救了兽人巫师乌尔夏克。他非常感激我，为此，他告诉了我沈睡者故事的剩余部分。\n现在，我可以返回萨尔达斯身边去完成我的任务了。,,,CH4_FindOrcShaman_2,,
Scripts/content/Story/Log_Constants.d:521,"Xardas schien zufrieden mit dem, was ich bei UrShak in Erfahrung bringen konnte. Mein weiterer Weg führt mich nun in die Freie Mine, um den Freund von Ur-Shak zu finden.",萨尔达斯似乎为我找到了乌尔夏克很高兴。现在，我的下一步就是去自由矿坑找乌\n尔夏克的朋友。,,,CH4_FindOrcShaman_3,,
Scripts/content/Story/Log_Constants.d:523,Minecrawlerplattenrüstung,矿坑爬行者的厚盔甲,,,CH4_MCPlateArmor,,
Scripts/content/Story/Log_Constants.d:524,"Der Bandit Wolf aus dem neuen Lager bot mir an, aus den Panzerplatten von Minecrawlern eine Rüstung anzufertigen. Er zeigte mir, wie man die Panzerplatten von toten Crawlern entfernt.",盗贼渥夫建议我，用矿坑爬行者的盔甲鳞片来做一件盔甲。他教会了我，怎样从死\n去的矿坑爬行者身上切除盔甲鳞片。,,,CH4_MCPlateArmor_1,,
Scripts/content/Story/Log_Constants.d:525,Wolf hat 15 dieser Minecralwerplatten von mir erhalten. Er benötigt etwas Zeit und bat mich später wiederzukommen.,渥夫已经收到了我给他的１５个矿坑爬行者的盔甲鳞片。他需要一段制做的时间，\n我稍后再回来。,,,CH4_MCPlateArmor_2,,
Scripts/content/Story/Log_Constants.d:526,"Die Rüstung ist fertig. Ein ausgezeichnetes Stück Arbeit und der beste Rüstungsschutz, den ich bisher gesehen habe.",盔甲已经做完了。做得非常漂亮，这是我至今为止见过的最好的防护盔甲。,,,CH4_MCPlateArmor_3,,
Scripts/content/Story/Log_Constants.d:528,Suche nach dem ULU-MULU,寻找乌卢刀,,,CH4_UluMulu,,
Scripts/content/Story/Log_Constants.d:529,"Nachdem ich dem Ork-Sklaven Tarrok seine spezielle Medizin wiederbeschafft habe, zeigt er sich sichtlich hilfsbereit.",因为我为兽人奴隶塔罗卡找回了特殊的药，所以他会帮我大忙的。,,,CH4_UluMulu_1,,
Scripts/content/Story/Log_Constants.d:530,"Ich habe den Freund von Ur-Shak in einem unteren Stollen der Freien Mine gefunden. Er heißt Tarrok, ist allerdings vergiftet und benötigt dringend eine spezielle Flasche Ork-Medizin, die er bei seiner Flucht hierher verloren hat. Sie liegt irgendwo hier in den unteren Stollen der Mine. Ich muß sie wiederfinden, sonst stirbt er.",在隧道中，我遇到了乌尔夏克的朋友。他叫塔罗卡。他中毒了，紧急需要一瓶特殊\n的兽人药。但是，他在逃跑时，丢在路上了。它就在矿坑里，底层隧道的某个地方\n。我必须找到它，否则他就会死去。,,,CH4_UluMulu_2,,
Scripts/content/Story/Log_Constants.d:531,"Ur-Shak, der verbannte Schamane verriet mir den einzigen Weg, in den unterirdischen Schläfertempel unter der Ork-Stadt zu gelangen, ohne gegen alle Orks kämpfen zu müssen. Ich brauche ein ULU-MULU, eine Art heilige Ork-Standarte, die von allen Orks als Symbol respektiert wird. Ein Freund von Ur-Shak, der in einer Mine der Meschen gefangen gehalten wird, kann mir eine solche Standarte herstellen.",乌尔夏克，那个被放逐的巫师，告诉我，只有一条可以不用和兽人发生冲突而进入\n兽人城镇下面沈睡者神殿的路。但是，我需要一把乌卢刀，它是所有兽人都尊敬的\n神圣信物。乌尔夏克有一位在人类矿坑里的朋友，他可以帮我这个忙。,,,CH4_UluMulu_3,,
Scripts/content/Story/Log_Constants.d:532,"Gorn und ich sollen in einer verdeckten Operation, die Rückeroberung der Freien Mine bewerkstelligen. Daß sich auch Ur-Shaks Ork-Freund dort befindet ist eine glückliche Fügung des Schicksals.",我和宫尔期望能以秘密行动的方式收复自由矿坑。事实上，乌尔夏克的兽人朋友也\n在那里。,,,CH4_UluMulu_4,,
Scripts/content/Story/Log_Constants.d:533,"Es ist vollbracht. Tarrok hat von mir alle vier Bestandteile erhalten und baute mir daraus ein Ulu-Mulu. Ich will hoffen, dass es von den Orks in der Stadt über dem Schläfer-Tempel auch wirklich respektiert wird.",已经完成了。塔罗卡收到了其余四部分，并用它们制造出了乌卢刀。我只希望，生\n活在沈睡者神殿上面的那些兽人也会尊重它。,,,CH4_UluMulu_5,,
Scripts/content/Story/Log_Constants.d:534,"Tarrok benötigt für das Ulu-Mulu die Zunge eines Feuerwarans. Sie leben vor allem im Orkgebiet und an sandigen Stränden. Gab es da nicht dieses Schiffswrack, bei dem es vor Waranen nur so wimmelte?",塔罗卡需要火蜥蜴的舌头来制造乌卢刀。它们主要生活在兽人地区的沙滩上。那儿\n不是有一艘装满蜥蜴的破船吗？,,,CH4_UluMulu_6,,
Scripts/content/Story/Log_Constants.d:535,"Tarrok benötigt für das Ulu-Mulu das Horns eines Schattenläufers. Sie leben vor allem in dunklen Wäldern und Höhlen. Soviel ich weiß, liegt der größte Wald in der Kolonie zwischen Altem Lager und Sumpflager.",塔罗卡需要火蜥蜴的舌头来制造乌卢刀。它们主要生活在兽人地区的沙滩上。我知\n道，殖民地里最大的森林在旧营地与沼泽地营地之间。,,,CH4_UluMulu_7,,
Scripts/content/Story/Log_Constants.d:536,Tarrok benötigt für das Ulu-Mulu Zähne eines Sumpfhais. Im Sumpf hinter dem Lager der Bruderschaft gibt es massenhaft Ungetüme dieser Art.,塔罗卡需要沼泽巨虫的牙齿来制造乌卢刀。在兄弟会营地的后面有许多这种野兽。,,,CH4_UluMulu_8,,
Scripts/content/Story/Log_Constants.d:537,Tarrok benötigt für das Ulu-Mulu die Hauer eines Trolls. Solche Monstren leben in den nördlichen Bergen der Kolonie. Ich sollte die Schluchten dort absuchen.,塔罗卡需要巨人的尖牙来制造乌卢刀。它们生活在殖民地北部的大山里。我应该去\n那里找它们。,,,CH4_UluMulu_9,,
Scripts/content/Story/Log_Constants.d:538,"Wolf der Bandit will mich unbedingt nochmal sprechen, bevor wir zur Mine aufbrechen. Ich sollte bei ihm vorbeischauen.",盗贼渥夫想在我们去矿坑前，再和我谈谈。我要去拜访他。,,,CH4_UluMulu_10,,
Scripts/content/Story/Log_Constants.d:540,Weg in den Schläfer-Tempel,进入沈睡者神殿之路,,,CH4_EnterTemple,,
Scripts/content/Story/Log_Constants.d:541,"Es ist mir gelungen in den Tempel des Schläfers zu gelangen. Ich habe nicht die geringste Ahnung was mich erwartet, aber ich werde es herausfinden.",我设法进入了沈睡者的神殿。我没有发现一点线索，但是我会找到的。,,,CH4_EnterTemple_1,,
Scripts/content/Story/Log_Constants.d:542,"Xardas war sichtlich überrascht, daß es mir gelungen war, in den unterirdischen Tempel einzudringen. Er hält mich wohl für die Ikone aus einer alten orkischen Prophezeiung.",萨尔达斯对我设法进入了地下神殿之举，十分惊讶。看起来，他像是以为我是一名\n老兽人预言中的那个人。,,,CH4_EnterTemple_2,,
Scripts/content/Story/Log_Constants.d:543,"Langsam verstehe ich Xardas' Ziel. Ich bat ihn um Hilfe bei der Zerstörung der magischen Barriere und er zeigt mir tatsächlich einen Weg, nur hat dieser Weg überhaupt nichts mit dem großen Erzhaufen der Wassermagier zu tun. Statt dessen verlangt er von mir, einen Weg in den unterirdischen Schläfer-Tempel zu finden.",现在，我开始明白萨尔达斯的目的了。我要求他帮忙毁坏魔法屏障，而他事实上向\n我指明了一条路，但是这条路跟水界法师们的矿石堆毫无关系。他要求我，找到一\n条进入沈睡者地下神殿的路，以代替毁坏魔法屏障。,,,CH4_EnterTemple_3,,
Scripts/content/Story/Log_Constants.d:544,"Gorn war wenig zuversichtlich, daß mir das ULU-MULU in der Orkstadt viel helfen würde. Was solls, ich werde es sehr bald herausgefunden haben... so oder so!",宫尔并不相信乌卢刀可以在兽人城镇发挥作用．．．那又如何？很快我就会知道它\n究竟有没有效果了。,,,CH4_EnterTemple_4,,
Scripts/content/Story/Log_Constants.d:545,"Varrag-Hashor, einer der fünf Ork-Schamanen, die damals den Schläfer auf diese Welt geholt haben, steht mir gegenüber. Ich werde sein untotes Dasein ein für allemal beenden.",我正面对着五个兽人巫师中的一位－－莞兰格尔。他把沈睡者带到了这个世界，我\n要结束这个不死生物的存在。,,,CH4_EnterTemple_5,,
Scripts/content/Story/Log_Constants.d:546,"Varrag-Kasorg, ein weiterer der fünf Ork-Schamanen, wird nun seine erbärmliche Existenz mir zu Füßen beenden!",现在，我要干掉五个兽人巫师中的另一位－－卡撒格了。,,,CH4_EnterTemple_6,,
Scripts/content/Story/Log_Constants.d:547,"Varrag-Unhilqt, einer der fünf Ork-Schamanen des Schläfers, steht vor mir. Nur einer von uns wird diese Kammer verlassen!",沈睡者的五个兽人巫师中的乌黑沃特，正站在我的前面。我们中只有一个人能活着\n离开这个房间！,,,CH4_EnterTemple_7,,
Scripts/content/Story/Log_Constants.d:548,"Varrag-Ruuushk, einer der untoten Schamanen der Schläfer-Herbeirufung kreuzt nun meinen Weg. Er wird mich nicht aufhalten, dafür sorge ich!",沈睡者的一个不死巫师拉斯克，正挡在我的路上。他想阻止我，我倒要看看他有什\n么能耐！,,,CH4_EnterTemple_8,,
Scripts/content/Story/Log_Constants.d:549,"Grash-Varrag-Arushat schient kein untoter Orkschamane wie die anderen zu sein. Es ist weitaus mächtiger und meine Waffen richteten nicht den geringsten Schaden an. Ich brauche eine Waffe, die mächtiger als alles andere ist!",格拉特显然不属于不死兽人巫师。但是，他的能量更强，我的武器并不能伤害他。\n我需要一种更强大的武器！,,,CH4_EnterTemple_9,,
Scripts/content/Story/Log_Constants.d:550,"Ich habe den Schamanen Ur-Shak vor der Orkstadt wiedergetroffen. Er verriet mir, dass ich nur mithilfe eines orkischen Zauberspruches in die Vorhalle des unterirdischen Tempels gelangen kann. Die anderen Ork-Schamanen bewahren solche Zauber in ihrer Höhle auf.",我在兽人城镇的前面又遇到了巫师乌尔夏克。他告诉我，我可以用一张兽人符咒进\n入地下神殿的前厅。在其他兽人巫师的洞里保存着那样的符咒。,,,CH4_EnterTemple_10,,
Scripts/content/Story/Log_Constants.d:551,Es gibt noch einen weiteren Weg in den Tempel. Ich muss die Schläferfigur von der heiligen Säule der Orkschamanen benutzen. Sie öffnet das Tor zum Tempel.,还有一种进入神殿的方法。我必须从兽人巫师的神柱上拿到沈睡者的小雕像，用它\n可以打开神殿的大门。,,,CH4_EnterTemple_11,,
Scripts/content/Story/Log_Constants.d:552,"Es gibt noch einen weiteren Weg in den Tempel zu gelangen. Auf der heiligen Säule der Orkschamanen steht eine Schläferfigur, die das Tor zum Tempel öffnet. Allerdings werden Ur-Shak's Brüder wenig begeistert sein, wenn sie bemerken, dass ich mich ihrer heiligen Ikone bediene.",还有一种进入神殿的方法。我必须从兽人巫师的神柱上拿到沈睡者的小雕像，用它\n可以打开神殿的大门。当乌尔夏克的弟兄们发现我用了他们的神圣标志时，他们是不会高兴的。,,,CH4_EnterTemple_12,,
Scripts/content/Story/Log_Constants.d:554,Aufnahme bei den Wassermagiern,水界法师的许可,,,CH4_SldToKdW,,
Scripts/content/Story/Log_Constants.d:555,Saturas hat mich in den Kreis der Wassermagier aufgenommen.,沙图拉斯现在已经允许我加入水界法师了。,,,CH4_SldToKdW_1,,
Scripts/content/Story/Log_Constants.d:561,Das magische Schwert URIZIEL,魔法剑－神圣之剑,,,CH5_Uriziel,,
