location,source,target,id,fuzzy,context,translator_comments,developer_comments
Scripts/content/Story/Log_Constants.d:272,"Horatio zeigt mir, wie ich meine Kraft im Kampf besser nutzen und damit stärker zuschlagen kann. Eine wahrhaft geläuterte Seele, dieser Mann.",霍拉提教给了我怎样在战斗中使用我的力量，以及怎样奋力攻敌。那就是一种真正\n纯净的精神。,,,CH1_HoratiosTeachings_2,,
Scripts/content/Story/Log_Constants.d:274,Die Große Sache der Bruderschaft,兄弟会的大事,,,CH1_GotoPsiCamp,,
Scripts/content/Story/Log_Constants.d:275,"Ich glaube, ich weiß jetzt genug über die Sektensache, daß ich Mordrag etwas darüber erzählen kann.",我相信现在我已经了解了学派学地的很多事务，所以我可以向摩达哥汇报了。,,,CH1_GotoPsiCamp_1,,
Scripts/content/Story/Log_Constants.d:276,Die Bruderschaft im Sumpflager bereitet irgendetwas großes vor. Lares der Anführer der Banditen will wissen was das ist.,沼泽地营地里的兄弟会正在计划一件大事。盗贼的头领赖理斯想知道那是什么事。,,,CH1_GotoPsiCamp_2,,
Scripts/content/Story/Log_Constants.d:277,"Ich soll Mordrag dabei unterstützen, herauszufinden was dort vor sich geht!",我要帮助摩达哥查明那里发生的事！,,,CH1_GotoPsiCamp_3,,
Scripts/content/Story/Log_Constants.d:278,Er hat mich direkt ins Lager der Bruderschaft geschickt.,他派我直接去兄弟会的营地。,,,CH1_GotoPsiCamp_4,,
Scripts/content/Story/Log_Constants.d:279,"Ein Bandit namens Mordrag soll sich um diese Sache kümmern, ich kann ihn in der Kneipe auf dem See des Neuen Lagers finden.",一个叫摩达哥的盗贼负责此事，我可以在新营地湖边的酒吧里找到他。,,,CH1_GotoPsiCamp_5,,
Scripts/content/Story/Log_Constants.d:280,"Mordrag hat die Spitzelaufgabe im Sumpflager geschickt auf mich abgewälzt. Die Gurus scheinen eine große Beschwörung vorzubereiten, aber was da dran ist, sollte ich besser genauer in Erfahrung bringen.",摩达哥已经去沼泽地营地做侦察员了。导师们似乎正在准备一次大型的祈祷仪式，\n但是我应该知道更多的数据。,,,CH1_GotoPsiCamp_6,,
Scripts/content/Story/Log_Constants.d:281,Im Lager der Bruderschaft soll ich einen Novizen namens Lester ansprechen. Er scheint vertrauenswürdig zu sein und hat Mordrag in der Vergangenheit auch schon mal geholfen.,我应该去兄弟会的营地里找莱斯特见习修士谈谈。他似乎是一个很可信的人，因为\n他以前帮助过摩达哥。,,,CH1_GotoPsiCamp_7,,
Scripts/content/Story/Log_Constants.d:282,"Mordrag hat sich halbtotgelacht, als ich ihm von den Minecrawlereiern erzählte. Er scheint allerdings kein großes Interesse mehr an der Spitzelei bei den Gurus zu haben. Ich betrachte den Auftrag einfach als erledigt!",当我告诉摩达哥关于矿坑爬行者蛋的情况时，他大笑着自杀了。他似乎对给导师作\n间谍的事已经不感兴趣了。我会考虑解决此事的！,,,CH1_GotoPsiCamp_8,,
Scripts/content/Story/Log_Constants.d:286,Aufnahme Sumpflager,沼泽地营地的任务,,,CH1_JoinPsi,,
Scripts/content/Story/Log_Constants.d:287,Von nun an ist das Alte Lager mein neues Zuhause. Die Bruderschaft des Schläfers wird ohne mich auskommen müssen.,从现在起，旧营地就是我的新家了。沈睡者的兄弟会不关我的事了。,,,CH1_JoinPsi_1,,
Scripts/content/Story/Log_Constants.d:288,"Lester's Schauspiel hat funktioniert. Baal Namib hat mir mir gesprochen und ist überzeugt, dass ich nun ein wahrer Anhänger des Glaubens bin. Ich soll nun den Guru Cor Kalom in seinem Alchemielabor aufsuchen!",莱斯特的事已经解决了。巴尔．那米和我说，他相信我已经是一名真正的信徒了。\n现在，我要去寇尔卡隆的炼金实验室拜访他！,,,CH1_JoinPsi_2,,
Scripts/content/Story/Log_Constants.d:289,"Baal Tondral hält mich für würdig, die Robe eines Novizen zu tragen!",巴尔．铜德拉认为我有资格穿戴见习修士的长袍！,,,CH1_JoinPsi_3,,
Scripts/content/Story/Log_Constants.d:290,"Baal Tyon hatte dank meines speziellen Geschenkes eine Vision! Er möchte, dass sich nun Cor Kalom mit mir befasst!",真是我的一份特殊礼物－－巴尔．泰昂看到了一切！他想让寇尔卡隆给我一份好差\n事！,,,CH1_JoinPsi_4,,
Scripts/content/Story/Log_Constants.d:291,"Baal Orun bezeichnete mich als würdigen Diener des Schläfers, da ich für die anderen Novizen im Sumpf gegen die Blutfliegen gekämpft habe.",巴尔．欧容说我是沈睡者的一名有价值的奴仆，因为我为了其他见习修士的利益，\n打死了沼泽地里的血苍蝇。,,,CH1_JoinPsi_5,,
Scripts/content/Story/Log_Constants.d:292,Baal Cadar hält mich für einen gelehrigen Schüler!,巴尔．卡塔尔认为我是一名可以接受的信徒！,,,CH1_JoinPsi_6,,
Scripts/content/Story/Log_Constants.d:293,"Cor Kalom nimmt mich als Novize in die Bruderschaft auf, wenn ich mindestens vier der Baal's davon überzeugen kann, für mich zu sprechen.",如果我能设法说服四名巴?斯帮我说好话，寇尔卡隆就会允许我作为一名见习修士\n加入兄弟会。,,,CH1_JoinPsi_7,,
Scripts/content/Story/Log_Constants.d:294,"Heute hat mich Cor Kalom zum Novizen ernannt. Er war zwar unausstehlich wie immer, doch nun gehöre ich endlich fest zur Bruderschaft im Sumpflager.",今天，寇尔卡隆已经任命我作一名见习修士了。他还是那样一副样子，但是现在我\n真的属于沈睡者的兄弟会了。,,,CH1_JoinPsi_8,,
Scripts/content/Story/Log_Constants.d:295,"Joru möchte meine tägliche Ration Sumpfkraut haben, die ich von Fortuno bekomme",朱富想拥有法图诺给我的日常沼泽烟草供应。,,FALSE,CH1_JoinPsi_9,,
Scripts/content/Story/Log_Constants.d:296,Um Baal Cadar zu beeindrucken muss ich auf einen seiner Zuhörer einen Schlafzauber legen.,为了给巴尔．卡塔尔留下好印像，我必须向他的一个信徒投掷一张催眠符咒。,,,CH1_JoinPsi_10,,
Scripts/content/Story/Log_Constants.d:297,"Wie man Baal Namib am Haupttor beeindrucken kann, soll ich den Novizen Lester fragen. Allerdings nicht in der Nähe des Gurus!",我要去问见习修士莱斯特，怎样讨好在主大门旁的巴尔．那米。但是，我应该确定\n那附近没有导师！,,,CH1_JoinPsi_11,,
Scripts/content/Story/Log_Constants.d:298,"Baal Parvez, ein Missionar der Bruderschaft sucht im Alten Lager nach neuen Anhängern für ihren Glauben an den SCHLÄFER! Er bot mir an, mich zum Sumpflager, der Heimat der Bruderschaft zu geleiten.",巴尔．帕菲兹是兄弟会的一名传见习修士。他呆在旧营地里，为沈睡者寻找新信徒\n！他提议陪我一起去沼泽地营地－－兄弟会的家。,,,CH1_JoinPsi_12,,
Scripts/content/Story/Log_Constants.d:299,"Das Sumpflager erstreckt sich unter mir. Mein Wegbegleiter empfahl mir, mit dem Guru Cor Kalom zu sprechen. Er ist der Aufseher über die Novizen und Lehrer.",沼泽地营地就在我的脚下了。我的同伴建议我去找寇尔卡隆谈谈。他是见习修士和\n助教们的首领。,,,CH1_JoinPsi_13,,
Scripts/content/Story/Log_Constants.d:300,Ein Novize namens Baal Parvez kann mich ins Sumpflager der Bruderschaft führen. Er hält sich am Marktplatz hinter der Burg des Alten Lagers auf.,一个叫巴尔．帕菲兹的见习修士可以带我去兄弟会的沼泽地营地。他在旧营地城堡\n后的市场里。,,,CH1_JoinPsi_14,,
Scripts/content/Story/Log_Constants.d:301,Baal Kagan hat mir einen speziell präparierten TRAUMRUF für Baal Tyon gegeben. Es wird mir helfen in die Bruderschaft der Sekte aufgenommen zu werden.,巴尔．卡甘给了我一个特殊的巴尔．泰昂召唤咒。那可以帮助我加入兄弟会教派。,,,CH1_JoinPsi_15,,
Scripts/content/Story/Log_Constants.d:302,"Die Bruderschaft muss nun wohl doch ohne mich auskommen, denn das Neue Lager ist nun mein neues Zuhause.",兄弟会不必处理我了，因为从现在起，新营地是我的家了。,,,CH1_JoinPsi_16,,
Scripts/content/Story/Log_Constants.d:303,"Wenn ich mich der Bruderschaft im Sumpflager anschließen möchte, muss ich die Gurus beeindrucken. Dummerweise reden sie nicht mit Neuen. Lester der Novize erzählte mir, dass sie mich trotzdem genau beobachten und ich mich in ihrer Nähe würdig erweisen müsse. Ich habe nicht die geringste Ahnung, wie ich das machen soll! Am besten sehe ich mich erst mal im Sumpflager genau um.",如果我想加入沼泽地营地里的兄弟会，那么，我必须取得导师的好感。不幸的是，\n他们不和陌生人说话。见习修士莱斯特告诉我，他们在悄悄地观察我，我必须向他\n们证明自己的价值。至于该怎么做，我一点头绪都有！我最好在沼泽地营地里四处\n好好看看。,,,CH1_JoinPsi_17,,
Scripts/content/Story/Log_Constants.d:304,"Um Baal Namib zu beeindrucken, soll ich Lester in der Nähe des Gurus ansprechen und über alte Götter und den Schläfer reden.",要取得巴尔．那米的好感，我应该向导师附近的莱斯特求助，和他讲讲旧神及沈睡\n者的事。,,,CH1_JoinPsi_18,,
Scripts/content/Story/Log_Constants.d:306,Ablösung für Ghorim,哥里姆的交班人,,,CH1_GhorimsRelief,,
Scripts/content/Story/Log_Constants.d:307,Ghorim wurde tatsächlich von Harlok abgelöst. Es geschehen noch Zeichen und Wunder.,哈乐克实际上已经代替了哥里姆。奇迹发生了。,,,CH1_GhorimsRelief_1,,
Scripts/content/Story/Log_Constants.d:308,"Der Novize Ghorim bat mich, den faulen Harlok dazu zu bewegen, ihn abzulösen. Harlok treibt sich meistens bei Fortunos Kräuterladen herum.",见习修士哥里姆请我让懒惰的哈乐克接管他的工作。哈乐克经常在法图诺的沼泽烟\n草店附近闲逛。,,,CH1_GhorimsRelief_2,,
Scripts/content/Story/Log_Constants.d:309,Harlok scheint ein uneinsichtiger Faulenzer zu sein. Ich glaube ich sollte seiner Einsicht etwas auf die Sprünge helfen...,看起来，哈乐克好像不仅懒惰，而且还很顽固。也许我应该帮助他．．．,,,CH1_GhorimsRelief_3,,
Scripts/content/Story/Log_Constants.d:310,Harlok -traf- die Einsicht. Er will nun Ghorim ablösen.,哈乐克终于得到了消息。现在，他将接管哥里姆的事了。,,,CH1_GhorimsRelief_4,,
,Ich habe Harlok wohl etwas zu hart getroffen. Er wird Ghorim nicht mehr ablösen...,Ich habe Harlok wohl etwas zu hart getroffen. Er wird Ghorim nicht mehr ablösen...,,,CH1_GhorimsRelief_5,,
,Ghorim war nicht gerade froh wegen Harlok. Jetzt wird er weiter stampfen müssen.,Ghorim war nicht gerade froh wegen Harlok. Jetzt wird er weiter stampfen müssen.,,,CH1_GhorimsRelief_6,,
Scripts/content/Story/Log_Constants.d:312,Die Sumpfkrauternte,沼泽烟草收成,,,CH1_DeliverWeed,,
Scripts/content/Story/Log_Constants.d:313,"Meine Überredungskünste bei Harlok, scheinen den Guru Baal Orun beeindruckt zu haben. Ich haben nun die 'Ehre' das gesammelte Kraut der Novizen im Sumpf zu Cor Kalom zu bringen.",我说服哈乐克的能力似乎已经给导师巴尔．欧容留下了印像。现在，我赢得了把沼\n泽地里所有的沼泽烟草运送给寇尔卡隆的荣誉。,,,CH1_DeliverWeed_1,,
Scripts/content/Story/Log_Constants.d:314,"Cor Kalom war unaustehlich wie immer, als ich ihm die heutige Sumpfkrauternte übergab.",当我给寇尔卡隆今天的沼泽烟草收成时，他是一副如往常一样无法忍受的样子。,,,CH1_DeliverWeed_2,,
Scripts/content/Story/Log_Constants.d:315,"Viran will mir seine Sumpfkrautlieferung erst geben, nachdem ich alle Blutfliegen in 20 Schritt Umkreis erlegt habe.",一旦我杀死了二十步内的所有血苍蝇，威兰就会给我沼泽烟草。,,,CH1_DeliverWeed_3,,
Scripts/content/Story/Log_Constants.d:316,"Viran gab mir die zweite Hälfte der heutigen Sumpfkrauternte. Mal sehen, ob Cor Kalom mit der Menge zufrieden ist.",威兰把今天的第二部分沼泽烟草收成给了我。让我们看看，寇尔卡隆是否会对这个\n数量满意吧。,,,CH1_DeliverWeed_4,,
Scripts/content/Story/Log_Constants.d:317,Viran übergab mir seine heutige Sumpfkrauternte. Sieht nach ziemlich wenig aus. Vielleicht gibt es noch eine zweite Sammlergruppe.,威兰给了我今天的沼泽烟草收成。但是看起来并不是很多。也许还有另外的收成吧。,,,CH1_DeliverWeed_5,,
Scripts/content/Story/Log_Constants.d:318,Balor übergab mir seine heutige Sumpfkrauternte für Cor Kalom.,拜拉把今天为寇尔卡隆收集的沼泽烟草给了我。,,,CH1_DeliverWeed_6,,
Scripts/content/Story/Log_Constants.d:319,"Laut Balor scheint es noch eine zweite Sammlergruppe zu geben, die auf der anderen Seite des Sumpfes arbeiten. Da ich Baal Orun keine Fragen stellen durfte, muss ich jetzt wohl oder übel diesen verdammten Sumpf nach der anderen Gruppe absuchen.",根据拜拉的意思，在沼泽地的另一边应该还有第二份收成。因为我不能问巴尔．欧\n容任何问题，所以我必须去查找沼泽地的第二份收成，不论我是否乐意。,,,CH1_DeliverWeed_7,,
Scripts/content/Story/Log_Constants.d:320,"Balor erwähnte einen Mann namens Cipher, der ein dankbarer Käufer für die Sumpfkrauternte wäre. Ich finde ihn in der Kneipe auf dem See des Neuen Lagers. Allerdings würde mir das gewaltigen Ärger mit den Gurus einbringen.",拜拉提到过一个叫赛佛的人，他喜欢购买沼泽烟草收成。我可以在新营地湖边的酒\n吧里找到他。可是，我会为此和导师们惹上大麻烦。,,,CH1_DeliverWeed_8,,
Scripts/content/Story/Log_Constants.d:322,Neue Seelen für die Bruderschaft,兄弟会的新精神,,,CH1_RecruitDusty,,
Scripts/content/Story/Log_Constants.d:323,Die Wache am hinteren Südtor hat sich tatsächlich bestechen lassen. Es hat einfach jeder seinen Preis!,我要设法贿赂南门后面的守卫。每个人都有他的价值嘛！,,,CH1_RecruitDusty_1,,
Scripts/content/Story/Log_Constants.d:324,"Baal Tondral schickt mich ins Alte Lager um einen neuen Mann für die Bruderschaft anzuwerben. Ich schätze das ist eine gute Gelegenheit, seine Gunst zu gewinnen!",巴尔．铜德拉派我去旧营地为兄弟会征募一个新人。我想，这是一次赢得他好感的\n好机会！,,,CH1_RecruitDusty_2,,
Scripts/content/Story/Log_Constants.d:325,Dusty ist jetzt ein Schüler von Baal Tondral. Damit ist meine Aufgabe erledigt.,现在，达斯帝是巴尔．铜德拉的弟子。我已经完成了我的任务。,,,CH1_RecruitDusty_3,,
Scripts/content/Story/Log_Constants.d:326,"Dusty, ein Buddler aus dem Alten Lager ist dort sehr unzufrieden. Er spielt mit dem Gedanken sich der Bruderschaft im Sumpf anzuschließen.",旧营地的采矿工达斯帝对于他目前的生活不再满意了。他想加入沼泽地里的兄弟会。,,,CH1_RecruitDusty_4,,
Scripts/content/Story/Log_Constants.d:327,"Ich konnte den Buddler Dusty dazu überreden, mit mir ins Sumpflager der Bruderschaft zu gehen. Allerdings werde ich die Torwachen mit etwas Erz zum wegsehen bewegen müssen. Am besten bringe ich ihn gleich direkt zu Baal Tondral.",我说服了采矿工达斯帝加入沼泽地营地里的兄弟会，但我必须用矿石贿赂那些守卫。\n如果我想带他直接去见巴尔．铜德拉，那么这是最好的办法。,,,CH1_RecruitDusty_5,,
Scripts/content/Story/Log_Constants.d:328,Dusty warnte mich davor das Haupttor im Norden zu benutzen. Die Wachen am hinteren Südtor sind angeblich empfänglicher für Bestechungen.,达斯帝警告我不要贿赂北面主大门的守卫。似乎南大门的守卫更容易接受贿赂。,,,CH1_RecruitDusty_6,,
Scripts/content/Story/Log_Constants.d:329,"Der Buddler Melvin hat sich der Bruderschaft angeschlossen. Sein Kumpel Dusty ist immer noch im Alten Lager, spielt aber ebenfalls mit dem Gedanken dort abzuhauen.",采矿工梅尔威已经加入了兄弟会。他的同伴达斯帝还在旧营地里，但是他也正想着\n离开那里。,,,CH1_RecruitDusty_7,,
Scripts/content/Story/Log_Constants.d:331,Kraut zu Gomez bringen,带给葛梅兹沼泽烟草,,,CH1_KrautBote,,
Scripts/content/Story/Log_Constants.d:332,Bartholo hat mir 500 Erz für die Krautlieferung gegeben.,巴索罗给了我５００个矿石作为沼泽烟草的运费。,,,CH1_KrautBote_1,,
Scripts/content/Story/Log_Constants.d:333,Die Krautlieferung für Gomez muss bei Bartholo abgegeben werden. Ich finde ihn im Haus der Erzbarone.,供应给葛梅兹的沼泽烟草一定放在巴索罗那里。我会在矿场主人的房子里找到他的。,,,CH1_KrautBote_2,,
Scripts/content/Story/Log_Constants.d:334,"Auf seine charmante Art und Weise schickte Cor Kalom mich zu Gomez ins Alte Lager, um ihm eine Lieferung Kraut zu bringen.",寇尔卡隆要我把他的沼泽烟草运送给旧营地里的葛梅兹。,,,CH1_KrautBote_3,,
Scripts/content/Story/Log_Constants.d:335,Cor Kalom hat das Geld für die Krautlieferung an die Erzbarone erhalten.,寇尔卡隆收到了运送给矿场主人的沼泽烟草的货款。,,,CH1_KrautBote_4,,
Scripts/content/Story/Log_Constants.d:337,Das Krautmonopol,沼泽烟草垄断商,,,CH1_DrugMonopol,,
Scripts/content/Story/Log_Constants.d:338,"Cor Kalom will, dass ich eine konkurrierende Krautproduktion einiger Leute im Neuen Lager unterbinde. Ich hab' keine Ahnung, wo genau ich anfangen soll zu suchen, aber ich sollte VOR dem Neuen Lager anfangen.",寇尔卡隆想让我去阻止新营地里日渐增加的私产烟草。我确实不知道该从何处开始\n，但是，我应该在新营地所有人的面前采取行动。,,,CH1_DrugMonopol_1,,
Scripts/content/Story/Log_Constants.d:339,Ich habe Cor Kalom die Einstellung der konkurrierenden Krautproduktion im Neuen Lager gemeldet. Er reagierte 'freundlich' wie immer.,我已经通知了寇尔卡隆，新营地里对沼泽烟草生产的对抗已经停止了。他的反应总\n是很’友好’。,,,CH1_DrugMonopol_2,,
Scripts/content/Story/Log_Constants.d:340,Ich habe die geheime Sumpfkrautproduktion gefunden. Jacko und zwei andere Banditen stellen hier Krautstengel her.,我找到了沼泽烟草的秘密生产基地。詹克和其他两个盗贼在这里生产沼泽烟草秆。,,,CH1_DrugMonopol_3,,
Scripts/content/Story/Log_Constants.d:341,"Eine kleine List mit Templern die es gar nicht gibt, hat die Angsthasen in die Flucht geschlagen. Dieses Problem dürfte vorerst erledigt sein.",他给圣战士惹了一次小麻烦，就被赶了出来。这个问题现在应该解决了。,,,CH1_DrugMonopol_4,,
Scripts/content/Story/Log_Constants.d:342,"Durch geschicktes Reden, habe ich dieses Problem gelöst. Jacko wurde die Sache hier zu heiß und ist abgehauen.",经过一番机智的谈话，我解决了这个问题。此事令詹克非常激动，他走开了。,,,CH1_DrugMonopol_5,,
Scripts/content/Story/Log_Constants.d:348,Fokus für die Gurus,导师的魔法源,,,CH2_Focus,,
Scripts/content/Story/Log_Constants.d:349,"Y'Berion hat den Novizen Nyras ausgesand, um den magischen Fokus zu holen, doch er kam bisher nicht zurück. Der Guru gab mir eine Karte, auf der der Weg zum Fokus eingezeichnet ist.",贝理昂已经把尼拉斯派出去寻找魔法源了，但是他还没有回来。导师给了我一张寻\n找魔法源的地图。,,,CH2_Focus_1,,
Scripts/content/Story/Log_Constants.d:350,"Y'Berion hat mich beauftragt, den Fokus zu einem anderen Guru namens 'Cor Kalom' zu bringen. Dieser Cor Kalom soll sich den ganzen Tag im Alchemielabor aufhalten.",贝理昂告诉我，要把魔法源交给另一位导师寇尔卡隆。寇尔卡隆天天都呆在炼金实\n验室里。,,,CH2_Focus_2,,
Scripts/content/Story/Log_Constants.d:351,"Y'Berion hat mich beauftragt, den Fokus zu Cor Kalom zu bringen. Welch eine 'Freude' diesen überaus liebenswürdigen Menschen wieder zu treffen.",贝理昂告诉我，要把魔法源交给另一位导师寇尔卡隆。再次遇到这样一个人是多么\n高兴的事啊！,,,CH2_Focus_3,,
Scripts/content/Story/Log_Constants.d:352,Ich habe den ominösen Fokus bei Cor Kalom abgeliefert!,我已经把那些不吉利的魔法源交给了寇尔卡隆！,,,CH2_Focus_4,,
Scripts/content/Story/Log_Constants.d:353,Nyras hat den Verstand verloren. Er will den Fokus für sich behalten und griff mich in seinem Wahn an.,尼拉斯已经失去理智了。他想自己留下魔法源，还向我袭击。,,,CH2_Focus_5,,
Scripts/content/Story/Log_Constants.d:354,"Der Novize Lester erzählte, dass Y'Berion einen magischen Fokus sucht. Der Guru hält sich im Inneren des Tempelbergs auf.",见习修士莱斯特告诉我，贝理昂正在寻找一块魔法源宝石。导师在神殿山里。,,,CH2_Focus_6,,
Scripts/content/Story/Log_Constants.d:356,Sekret der Minecrawler,矿坑爬行者的分泌物,,,CH2_MCEggs,,
Scripts/content/Story/Log_Constants.d:357,"Asghan, der Chef der Minengardisten weigert sich das Tor zu öffnen. Er will erst die Erlaubnis von Ian haben.",矿坑守卫的上司阿思汉不会打开大门的。他必须得到伊恩的允许。,,,CH2_MCEggs_1,,
Scripts/content/Story/Log_Constants.d:358,"Trotz Ian's Einwilligung will Asghan das Tor erst öffnen, wenn ich einige Templer als Verstärkung vor dem Tor versammelt habe.",虽然我已经得到了伊恩的许可，但是在我还没有在门口聚集足够的圣战士之前，阿\n思汉是不会打开大门的。,,,CH2_MCEggs_2,,
Scripts/content/Story/Log_Constants.d:359,Ich habe genug Templer vor Asghans Tor versammeln können. Was uns wohl in der Dunkelheit hinter dem Tor erwartet?,我设法联合了许多圣战士，聚集在阿思汉的大门前。但是在大门之后会是什么在等\n待我们呢？,,,CH2_MCEggs_3,,
Scripts/content/Story/Log_Constants.d:360,"Der Guru Cor Kalom hat mich beauftragt in der Alten Mine nach einer Quelle für Minecrawlersekret zu suchen. Bisher wurden dafür die Zangen dieser Monster benutzt, doch ich soll etwas anderes, besonderes finden, aus dem man ein besonders starkes Sekret herstellen könnte",导师寇尔卡隆要求我要找到旧矿坑里矿坑爬行者的分泌物的源头。怪物的牙齿已经\n派上用场了，但是我要找到一种更强大的分泌物。,,FALSE,CH2_MCEggs_4,,
Scripts/content/Story/Log_Constants.d:361,Ich habe Cor Kalom 3 der Minecrawler-Eier übergeben. Er war recht unhöflich und ich mußte meine karge Belohnung erst penetrant einfordern!,我已经给了寇尔卡隆三只矿坑爬行者蛋。他对我很不友好，但我必须要求应得奖赏！,,,CH2_MCEggs_5,,
Scripts/content/Story/Log_Constants.d:362,"Ian der Minenboss will mir nicht helfen das Nest zufinden Ich soll ihm erst ein neues Zahnrad für ihren kaputten Erzstampfer besorgen. Er erwähnte einen verlassenen Nebenstollen, in dem sich noch ein alter Stampfer befinden soll.",矿坑的老板伊恩不会帮我找到矿坑爬行者的巢。除非我给他的矿石粉碎机换上一个\n新齿轮。他说，在一个废弃的隧道边上，我可以找到一架旧粉碎机。,,,CH2_MCEggs_6,,
Scripts/content/Story/Log_Constants.d:363,"Ich habe Ian das Zahnrad des verlassenen Erzstampfers gebracht.Ian sagte mir,wenn ich Asgahn die Worte ALLES WIRD GUT sagen, dann wird er das Tor zu den dunklen Schächten öffnen.",我从一架旧矿石粉碎机上，给伊恩拿来了这个齿轮。伊恩说，我可以去找阿思汉，\n一切都没有问题。显然，他会给我打开通风井的门了。,,,CH2_MCEggs_7,,
Scripts/content/Story/Log_Constants.d:364,"Wenn ich das Minecrawlernest finden will, sollte ich mit Asghan reden.",如果我想找到矿坑爬行者的巢穴，我就必须去和阿思汉谈谈。,,,CH2_MCEggs_8,,
Scripts/content/Story/Log_Constants.d:365,"Als ich das Nest der Minecrawler erwähnte, schloß sich der Templer Gor Na Bar sofort meiner Verstärkung bei Asghans Tor an. Ich werde ihn dort finden.",当我提及矿坑爬行者巢穴时，在阿思汉的大门处的圣战士巴尔决定支持我。我会在\n那里找到他的。,,,CH2_MCEggs_9,,
Scripts/content/Story/Log_Constants.d:366,Ich konnte den Templer Gor Na Kosh als Verstärkung für Asghans Tor gewinnen. Er wartet dort auf mich.,在阿思汉的大门处，我说服了圣战士克丝支持我。他正在那里等着我。,,,CH2_MCEggs_10,,
Scripts/content/Story/Log_Constants.d:367,"Ich sollte die Eier zu Cor-Kalom bringen, er wird sie schon sehnsüchtig erwarten.",我要把矿坑爬行者的蛋拿给寇尔卡隆，他正在等着它们呢。,,,CH2_MCEggs_11,,
Scripts/content/Story/Log_Constants.d:368,"Ich mußte Gor Na Vid erst einen Heiltrank geben, bevor er sich als Verstärkung bei Asghans Tor zur Verfügung stellte.",我必须在阿思汉的大门处，先给维德一个康复药剂，然后他才会支持我。,,,CH2_MCEggs_12,,
Scripts/content/Story/Log_Constants.d:369,"Ich fragte einen Templer am Eingang der Alten Mine nach dem Nest der Minecrawler. Er verwies mich an drei andere Templer mit Namen Gor Na Vid, Gor Na Kosh und Gor Na Bar. Diese Namen der Bruderschaft bringen mich noch um den Verstand.",在旧矿坑的入口，我向一名圣战士打听矿坑爬行者的巢穴。他向我提到了其他三位\n圣战士－－葛纳维德、葛纳克丝和葛纳巴尔。我要去找他们。,,,CH2_MCEggs_13,,
Scripts/content/Story/Log_Constants.d:371,Almanach,年鉴,,,CH2_Book,,
Scripts/content/Story/Log_Constants.d:372,"Ich habe Talas angeboten, für ihn den Almanach wiederzubeschaffen. Er will mich zum Aufenthaltsort des Buches führen.",我建议塔拉斯，去给他把历书夺回来。他想带我去丢书的地方。,,,CH2_Book_1,,
Scripts/content/Story/Log_Constants.d:373,Wir stehen nun vor dem Eingang einer Goblinhöhle. Dieser Feigling von Novize will mich doch tatsächlich alleine hinein gehen lassen.,现在，我们站在哥布林的洞穴前。但是，这个胆小的见习修士想让我自己进去。,,,CH2_Book_2,,
