Column1,Column2,Column3,Column4,Column5,Column6,Column7,Column8
Scripts/content/Story/svm.d:1039, ... lass uns lieber über was anderes reden ..., ．．．我们来聊些其他的事情吧．．．,,,SVM_6_Smalltalk24,,
Scripts/content/Story/svm.d:1040,Omm...,噢,,,SVM_6_Om,,
Scripts/content/Story/svm.d:1046,Steck das weg! Steck es weg!!,放下它！放下它！！,,,SVM_7_StopMagic,,
Scripts/content/Story/svm.d:1047,"Die Magie weg, pack sie weg!!",放下魔法，放下！！,,,SVM_7_ISaidStopMagic,,
Scripts/content/Story/svm.d:1048,"Weg mit der Waffe, weg damit!",放下武器！放下！,,,SVM_7_WeaponDown,,
Scripts/content/Story/svm.d:1049,Ich mein's ernst! Weg damit!,我是认真的！放下！,,,SVM_7_ISaidWeaponDown,,
Scripts/content/Story/svm.d:1050,Auf mich zielen? Pass auf du!,你瞄准我吗？当心！,,,SVM_7_WatchYourAim,,
Scripts/content/Story/svm.d:1051,Willst du mir Angst machen? Ich hab' keine Angst!,你以为你能胁迫我吗？再想想吧！,,,SVM_7_WatchYourAimAngry,,
Scripts/content/Story/svm.d:1052,Das merk ich mir! Pass auf!,我会记着的！当心！,,,SVM_7_WhatAreYouDoing,,
Scripts/content/Story/svm.d:1053,"Den Streit vergisst du, okay?",你会忘记争论的，对吧？,,,SVM_7_LetsForgetOurLittleFight,,
Scripts/content/Story/svm.d:1054,Wo ist er hin? Das kann nicht sein! Das gibt es nicht!!,他去哪儿了？不可能！那是不可能的！,,,SVM_7_Strange,,
Scripts/content/Story/svm.d:1055,"Ich zerhack dich, du Mistvieh!",我要砍死你，畜生！,,,SVM_7_DieMonster,,
Scripts/content/Story/svm.d:1056,Jetzt sezier ich dich! Du bist dran! Keine Gnade!,我要撕碎你！那是你的报应！没有怜悯！,,,SVM_7_DieMortalEnemy,,
Scripts/content/Story/svm.d:1057,Endlich lieferst du mir einen Grund!,你总算给了我一个理由！,,,SVM_7_NowWait,,
Scripts/content/Story/svm.d:1058,Du willst es doch wohl nicht noch mal versuchen?,你不想再尝试了，是不是？,,,SVM_7_YouStillNotHaveEnough,,
Scripts/content/Story/svm.d:1059,Blut! Dein Blut!!,血！你的血！！,,,SVM_7_YouAskedForIt,,
Scripts/content/Story/svm.d:1060,Ich schneide dich in Streifen!,我会砍碎你！,,,SVM_7_NowWaitIntruder,,
Scripts/content/Story/svm.d:1061,Die Finger sollte ich dir abschneiden!,我要剁断你的手指！,,,SVM_7_IWillTeachYouRespectForForeignProperty,,
Scripts/content/Story/svm.d:1062,Du mieser Dieb! Ich will dich leiden sehen!,你这个卑鄙的小偷，不得好死！,,,SVM_7_DirtyThief,,
Scripts/content/Story/svm.d:1063,"Wenn hier jemand Prügel austeilt, bin ich das!",在这周围，除了我再没有人能修理其他人！,,,SVM_7_YouAttackedMyCharge,,
Scripts/content/Story/svm.d:1064,Du hast einen von uns gekillt!,你杀了一个我们的人！,,,SVM_7_YouKilledOneOfUs,,
Scripts/content/Story/svm.d:1065,Aaarg,啊,,,SVM_7_Dead,,
Scripts/content/Story/svm.d:1066,Aargh,啊,,,SVM_7_Aargh_1,,
Scripts/content/Story/svm.d:1067,Aargh,啊,,,SVM_7_Aargh_2,,
Scripts/content/Story/svm.d:1068,Aargh,啊,,,SVM_7_Aargh_3,,
Scripts/content/Story/svm.d:1069,UUAAARRGGGHHH!!!,呜啊！！！,,,SVM_7_Berzerk,,
Scripts/content/Story/svm.d:1070,"Du wirst wenig Zeit haben, das zu bereuen!",你不会有时间为此歉疚的！,,,SVM_7_YoullBeSorryForThis,,
Scripts/content/Story/svm.d:1071,Schon gut! Schon gut!,好吧，好吧！,,,SVM_7_YesYes,,
Scripts/content/Story/svm.d:1072,Ich hab' nicht die richtige Waffe. Wir sehen uns ...,我没有合适的武器。我们会再见的．．．,,,SVM_7_ShitWhatAMonster,,
Scripts/content/Story/svm.d:1073,Verdammt!,该死！,,,SVM_7_Help,,
Scripts/content/Story/svm.d:1074,Wir sprechen uns noch!,我会留心你的！,,,SVM_7_WeWillMeetAgain,,
Scripts/content/Story/svm.d:1075,Tu das nie wieder!,不要再那么做！,,,SVM_7_NeverTryThatAgain,,
Scripts/content/Story/svm.d:1076,Die Waffe behalte ich!,我将保留那种武器！,,,SVM_7_ITakeYourWeapon,,
Scripts/content/Story/svm.d:1077,"Lieber würde ich dich umbringen, aber das Erz ist auch nicht schlecht!",我想杀了你，但是，这些矿石还不错！,,,SVM_7_ITookYourOre,,
Scripts/content/Story/svm.d:1078,Kein Erz? Du nutzloses Stück Dreck!,没有矿石？没用的东西！,,,SVM_7_ShitNoOre,,
Scripts/content/Story/svm.d:1079,Behalt deine Drecksgriffel bei dir!,放下！,,,SVM_7_HandsOff,,
Scripts/content/Story/svm.d:1080,Verzieh dich! Raus hier!,快滚！滚开！,,,SVM_7_GetOutOfHere,,
Scripts/content/Story/svm.d:1081,Wie kommst du hier rein?,你怎样到这儿的？,,,SVM_7_YouViolatedForbiddenTerritory,,
Scripts/content/Story/svm.d:1082,Du versuchst tatsächlich mich zu verarschen!,你很喜欢利用我，不是吗？,,,SVM_7_YouWannaFoolMe,,
Scripts/content/Story/svm.d:1083,Hey du! Was schleichst du da rum.,嘿！你在这儿鬼鬼祟祟地做什么？,,,SVM_7_WhatsThisSupposedToBe,,
Scripts/content/Story/svm.d:1084,"Verschwinde, sonst ruf ich die Wachen!",走开，否则我叫守卫了！,,,SVM_7_WhyYouAreInHere,,
Scripts/content/Story/svm.d:1085,Du hast da drinnen nichts zu suchen!,那儿没你的事了！,,,SVM_7_WhatDidYouInThere,,
Scripts/content/Story/svm.d:1086,Dein Glück! Aber ich hätte dir auch gerne die Fresse poliert!,你很幸运！但是，我真想撕碎你！,,,SVM_7_WiseMove,,
Scripts/content/Story/svm.d:1087,"Wachen, zu mir!",守卫，过来！,,,SVM_7_Alarm,,
Scripts/content/Story/svm.d:1088,ALARM!!,警报！！,,,SVM_7_IntruderAlert,,
Scripts/content/Story/svm.d:1089,Hinter dir!,在你后面！,,,SVM_7_BehindYou,,
Scripts/content/Story/svm.d:1090,Ein Kampf!,一场战斗！,,,SVM_7_TheresAFight,,
Scripts/content/Story/svm.d:1091,Fester!,用力！,,,SVM_7_HeyHeyHey,,
Scripts/content/Story/svm.d:1092,Ich will Blut sehen!,我想看到血！,,,SVM_7_CheerFight,,
Scripts/content/Story/svm.d:1093,Mach ihn fertig!!,打倒他！,,,SVM_7_CheerFriend,,
Scripts/content/Story/svm.d:1094,"Wehr dich, du Flasche!",回击，你个白痴！,,,SVM_7_Ooh,,
Scripts/content/Story/svm.d:1095,Jaaaa!!!,好！！！,,,SVM_7_YeahWellDone,,
Scripts/content/Story/svm.d:1096,Renn heim zu Mutti!!,回去找你妈吧！！,,,SVM_7_RunCoward,,
Scripts/content/Story/svm.d:1097,Der hat genug!,他已经受够了！,,,SVM_7_HeDefeatedHim,,
Scripts/content/Story/svm.d:1098,Selbst schuld!,那是你个人的问题！,,,SVM_7_HeDeservedIt,,
Scripts/content/Story/svm.d:1099,"Du bist wirklich lebensmüde, vor Zeugen jemanden kaltzumachen.",证据显示人是自杀的。,,,SVM_7_HeKilledHim,,
Scripts/content/Story/svm.d:1100,Netter Kampf!,打得好！,,,SVM_7_ItWasAGoodFight,,
Scripts/content/Story/svm.d:1101,Schon wieder aufstehen!,又该起床了！,,,SVM_7_Awake,,
Scripts/content/Story/svm.d:1102,Hallo!,你好！,,,SVM_7_FriendlyGreetings,,
Scripts/content/Story/svm.d:1103,Für Gomez!,为了葛梅兹！,,,SVM_7_ALGreetings,,
Scripts/content/Story/svm.d:1104,Magie zu Ehren!,为了魔法的荣耀！,,,SVM_7_MageGreetings,,
Scripts/content/Story/svm.d:1105,Erwache!,醒醒！,,,SVM_7_SectGreetings,,
Scripts/content/Story/svm.d:1106,Bist du blind? Da vorne!,你瞎了吗？在那边！,,,SVM_7_ThereHeIs,,
Scripts/content/Story/svm.d:1107,Ich kann dir nichts beibringen. Du hast nicht genug Erfahrung.,我不能教你什么，因为你没有足够的经验。,,,SVM_7_NoLearnNoPoints,,
Scripts/content/Story/svm.d:1108,Du bist am Ende deiner Möglichkeiten. Du solltest etwas anderes lernen.,你已经无能为力了。你应该学习新的东西。,,,SVM_7_NoLearnOverMax,,
Scripts/content/Story/svm.d:1109,"Du musst erst fortgeschritten sein, bevor du Meister werden kannst!",在你成为大师之前，你必须努力提高自己的能力！,,,SVM_7_NoLearnYouAlreadyKnow,,
Scripts/content/Story/svm.d:1110,Du bist jetzt schon besser!,现在你很好！,,,SVM_7_NoLearnYoureBetter,,
Scripts/content/Story/svm.d:1111,Hey du!,嗨，就是你！,,,SVM_7_HeyYou,,
Scripts/content/Story/svm.d:1112,Nicht jetzt!,现在不！,,,SVM_7_NotNow,,
Scripts/content/Story/svm.d:1113,Was willst du von mir?,你想要什么？,,,SVM_7_WhatDoYouWant,,
Scripts/content/Story/svm.d:1114,Kann ich was für dich tun?!,我能帮你吗？！,,,SVM_7_ISaidWhatDoYouWant,,
Scripts/content/Story/svm.d:1115,Lass mich vorbei.,让我过去。,,,SVM_7_MakeWay,,
Scripts/content/Story/svm.d:1116,Mach Platz!,让开！,,,SVM_7_OutOfMyWay,,
Scripts/content/Story/svm.d:1117,Suchst du Streit? Weg da!,找麻烦吗？滚！,,,SVM_7_YouDeafOrWhat,,
Scripts/content/Story/svm.d:1118,Willst du dich noch mal mit mir anlegen?,你又找我麻烦？,,,SVM_7_LookingForTroubleAgain,,
Scripts/content/Story/svm.d:1119,Ich hab' NICHTS gesehen!,我什么都没看见！,,,SVM_7_LookAway,,
Scripts/content/Story/svm.d:1120,"Gut, gut! Kannst es behalten!",好吧，好吧！留下它！,,,SVM_7_OkayKeepIt,,
Scripts/content/Story/svm.d:1121,Was war denn das?,那是什么？,,,SVM_7_WhatsThat,,
Scripts/content/Story/svm.d:1122,Gib mir meine Waffe zurück!,把我的武器还给我！,,,SVM_7_ThatsMyWeapon,,
Scripts/content/Story/svm.d:1123,Her damit!,把东西交给我！,,,SVM_7_GiveItToMe,,
Scripts/content/Story/svm.d:1124,Auch gut! Behalt es! Ich finde 'ne andere Lösung!,好！放下它！我会找到别的解决方法！,,,SVM_7_YouCanKeeptheCrap,,
Scripts/content/Story/svm.d:1125,Einer von uns hat ins Gras gebissen! Das schreit nach Rache!,我们的一个人死了！报仇哇！,,,SVM_7_TheyKilledMyFriend,,
Scripts/content/Story/svm.d:1126,Warum weckst du mich?,你为什么叫醒我？,,,SVM_7_YouDisturbedMySlumber,,
Scripts/content/Story/svm.d:1127,"Geschieht dir recht, dass du 'ne Abreibung bekommen hast!",你活该挨打了！,,,SVM_7_SuckerGotSome,,
Scripts/content/Story/svm.d:1128,Du hast einen Erzbaron umgehauen. Er ist so richtig wütend!,你击倒了一个矿场主人！他对你十分愤怒！,,,SVM_7_SuckerDefeatedEBr,,
Scripts/content/Story/svm.d:1129,Du hast einen Guru niedergeschlagen. Irgendwie ziehst du Ärger an!,你把一个导师打倒了。不知为何，你会不由自主地碰到麻烦！,,,SVM_7_SuckerDefeatedGur,,
Scripts/content/Story/svm.d:1130,Einen Magier zu besiegen ist 'ne wirklich beschissene Idee!,战胜法师是一个很臭的主意！,,,SVM_7_SuckerDefeatedMage,,
Scripts/content/Story/svm.d:1131,Du verprügelst also die Novizen!,所以，你就是那个打死见习修士的人！,,,SVM_7_SuckerDefeatedNov_Guard,,
Scripts/content/Story/svm.d:1132,Lass die Finger von meinen Jungs!,不要打扰我的人！,,,SVM_7_SuckerDefeatedVlk_Guard,,
Scripts/content/Story/svm.d:1133,Du hast den Falschen umgehauen! Wir halten hier zusammen!,你打错了！我们在这儿粘住了！,,,SVM_7_YouDefeatedMyComrade,,
Scripts/content/Story/svm.d:1134,"Das läuft nicht, dass du hier Unruhe stiftest!",你在这儿闯的祸不会被容忍的！,,,SVM_7_YouDefeatedNOV_Guard,,
Scripts/content/Story/svm.d:1135,"Wenn du jemand verprügelst, der unter meinem Schutz steht, hat das Konsequenzen!",如果你与我保护下的人作对，我是绝不会放过你的！,,,SVM_7_YouDefeatedVLK_Guard,,
Scripts/content/Story/svm.d:1136,Du Arsch hast mich beklaut! Versuch das nicht noch mal!,坏蛋，你偷了我的东西！不要再偷了！,,,SVM_7_YouStoleFromMe,,
Scripts/content/Story/svm.d:1137,Wir wollen unsere Sachen wiederhaben! Lass sehen!,我们要拿回我们的东西！还给我们！,,,SVM_7_YouStoleFromUs,,
Scripts/content/Story/svm.d:1138,Du hast die Erzbarone beklaut! Was soll der Scheiß?,你偷了矿场主人的东西！真该死！,,,SVM_7_YouStoleFromEBr,,
Scripts/content/Story/svm.d:1139,"Du hast die Gurus beklaut? Zu blöd, dass es rausgekommen ist!",你偷导师的东西？真遗憾他们发现了你。,,,SVM_7_YouStoleFromGur,,
Scripts/content/Story/svm.d:1140,Du hast die Magier beklaut! Eine echt beschissene Idee!,你偷法师的东西！一个很恶心的主意！,,,SVM_7_StoleFromMage,,
Scripts/content/Story/svm.d:1141,Einer unserer eigenen Leute ist tot und du hast damit zu tun! Der kleinste Fehler noch und du bist Freiwild!,我们死了一个人，你与他的死有关系！你做错了！,,,SVM_7_YouKilledMyFriend,,
Scripts/content/Story/svm.d:1142,"Du hast einen Erzbaron umgelegt! Mann, du bist wohl komplett durchgedreht!?",你杀了一个矿场主人！你彻底疯了！,,,SVM_7_YouKilledEBr,,
Scripts/content/Story/svm.d:1143,"Du hast einen Guru getötet! Junge, das kann doch nicht wahr sein!",你杀了一个导师！小伙子，我不相信！,,,SVM_7_YouKilledGur,,
Scripts/content/Story/svm.d:1144,Du hast einen Magier umgebracht! Wie zum Teufel sollen wir das denn erklären?,你杀死了一个法师，你打算如何来证明这是合法的?,,,SVM_7_YouKilledMage,,
Scripts/content/Story/svm.d:1145,Jemand aus dem Alten Lager ist tot und dein Name wird dabei erwähnt ...,旧营地死了一个人，你被认为与他的死有关．．．,,,SVM_7_YouKilledOCfolk,,
Scripts/content/Story/svm.d:1146,"Das Neue Lager hat einen tragischen Verlust erlitten, und scheinbar hast du damit zu tun!",新营地受到了很大的损失，很明显你涉嫌重大！,,,SVM_7_YouKilledNCfolk,,
Scripts/content/Story/svm.d:1147,"Die Bruderschaft ist um einen Anhänger ärmer und wie es scheint, warst du das!",兄弟会失去了一个教徒，你涉嫌杀死了他！,,,SVM_7_YouKilledPSIfolk,,
Scripts/content/Story/svm.d:1148,Das wieder hinzubiegen wird nicht einfach!,澄清它并不容易！,,,SVM_7_GetThingsRight,,
Scripts/content/Story/svm.d:1149,"Du hast mir ganz schön aufs Maul gehauen, Mann. War ein guter Kampf. Aber jetzt ist gut!",你干得很好，年轻人！但是，现在战斗已经结束了！,,,SVM_7_YouDefeatedMeWell,,
Scripts/content/Story/svm.d:1150, ... wenn du meinst ..., ．．．如果你想．．．,,,SVM_7_Smalltalk01,,
Scripts/content/Story/svm.d:1151, ... kann schon sein ..., ．．．或许吧．．．,,,SVM_7_Smalltalk02,,
Scripts/content/Story/svm.d:1152, ... war nicht besonders schlau ..., ．．．那不是很聪明的行为．．．,,,SVM_7_Smalltalk03,,
Scripts/content/Story/svm.d:1153, ... ich halt mich da lieber raus ..., ．．．我最好置身事外．．．,,,SVM_7_Smalltalk04,,
Scripts/content/Story/svm.d:1154, ... das ist wirklich nicht mein Problem ..., ．．．那并不是我的问题．．．,,,SVM_7_Smalltalk05,,
Scripts/content/Story/svm.d:1155," ... war doch klar, dass das Ärger gibt ...", ．．．很明显地前面将会出现麻烦．．．,,,SVM_7_Smalltalk06,,
Scripts/content/Story/svm.d:1156," ... aber behalt's für dich, muss nicht gleich jeder wissen ...", ．．．但是请你保守秘密，不要告诉其他人。,,,SVM_7_Smalltalk07,,
Scripts/content/Story/svm.d:1157, ... das passiert mir nicht noch mal ..., ．．．不会再发生了．．．,,,SVM_7_Smalltalk08,,
Scripts/content/Story/svm.d:1158, ... an der Geschichte muss wohl doch was dran sein ..., ．．．那个故事一定会有后续发展．．．,,,SVM_7_Smalltalk09,,
Scripts/content/Story/svm.d:1159," ... man muss eben aufpassen, was man rumerzählt ...", ．．．你必须注意你所讲的话．．．,,,SVM_7_Smalltalk10,,
Scripts/content/Story/svm.d:1160, ... solange ich damit nichts zu tun habe ..., ．．．只要与我无关．．．,,,SVM_7_Smalltalk11,,
Scripts/content/Story/svm.d:1161," ... man darf auch nicht alles glauben, was man hört ...", ．．．你不应该相信你听到的事情．．．,,,SVM_7_Smalltalk12,,
Scripts/content/Story/svm.d:1162, ... in seiner Haut will ich trotzdem nicht stecken ..., ．．．然而我并不想要进入他的圈子里．．．,,,SVM_7_Smalltalk13,,
Scripts/content/Story/svm.d:1163, ... immer wieder dieselbe Leier ..., ．．．每次都是同样的老故事．．．,,,SVM_7_Smalltalk14,,
Scripts/content/Story/svm.d:1164, ... manche lernen eben gar nichts dazu ..., ．．．有些人永远学不会教训．．．,,,SVM_7_Smalltalk15,,
Scripts/content/Story/svm.d:1165, ... früher wäre das ganz anders gelaufen ..., ．．．曾经有一段时间，事物都以不同的方式消失．．．,,,SVM_7_Smalltalk16,,
Scripts/content/Story/svm.d:1166, ... gequatscht wird viel ..., ．．．人们总是这样谈论．．．,,,SVM_7_Smalltalk17,,
Scripts/content/Story/svm.d:1167, ... ich hör' nicht mehr auf das Gefasel ..., ．．．我再也不想听那些废话了．．．,,,SVM_7_Smalltalk18,,
Scripts/content/Story/svm.d:1168," ... verlass dich auf jemanden und du bist verlassen, das ist eben so ...", ．．．依赖某人然后陷入困境之中，这就是事实呀．．．,,,SVM_7_Smalltalk19,,
Scripts/content/Story/svm.d:1169," ... ich glaube kaum, dass sich daran was ändern wird ...", ．．．我怀疑它是否不断地改变．．．,,,SVM_7_Smalltalk20,,
Scripts/content/Story/svm.d:1170, ... wahrscheinlich hast du Recht ..., ．．．你也许是对的．．．,,,SVM_7_Smalltalk21,,
Scripts/content/Story/svm.d:1171," ... erst mal abwarten. Es wird nichts so heiß gegessen, wie es gekocht wird ...", ．．．好，就这样坚持下去。最好都不要草率行事．．．,,,SVM_7_Smalltalk22,,
Scripts/content/Story/svm.d:1172," ... ich dachte, das wäre schon lange geklärt ...", ．．．我想它在很久以前就已经被清除了．．．,,,SVM_7_Smalltalk23,,
Scripts/content/Story/svm.d:1173, ... lass uns lieber über was anderes reden ..., ．．．我们来聊些其他的事情吧．．．,,,SVM_7_Smalltalk24,,
Scripts/content/Story/svm.d:1174,Omm...,噢,,,SVM_7_Om,,
Scripts/content/Story/svm.d:1180,"Keine Zaubereien, in meiner Nähe!",不要在我周围施展魔法！,,,SVM_8_StopMagic,,
Scripts/content/Story/svm.d:1181,"Aufhören, sag' ich! Sofort!",我说，停！马上！,,,SVM_8_ISaidStopMagic,,
Scripts/content/Story/svm.d:1182,Waffe weg!,放下武器！,,,SVM_8_WeaponDown,,
Scripts/content/Story/svm.d:1183,"Steck das Ding weg, oder du bist dran!",放下它，否则有你好看的！,,,SVM_8_ISaidWeaponDown,,
Scripts/content/Story/svm.d:1184,"Waffe runter, Idiot!",放下武器，白痴！,,,SVM_8_WatchYourAim,,
Scripts/content/Story/svm.d:1185,"Du Wurm wagst es, auf mich anzulegen?",你竟敢瞄准我？,,,SVM_8_WatchYourAimAngry,,
Scripts/content/Story/svm.d:1186,Pass doch auf!,当心！,,,SVM_8_WhatAreYouDoing,,
Scripts/content/Story/svm.d:1187,"Gut, vergessen wir unseren kleinen Streit.",好，让我们忘掉刚才的不快吧。,,,SVM_8_LetsForgetOurLittleFight,,
Scripts/content/Story/svm.d:1188,"Komm raus! Ich weiß, dass du mich hörst!",出来！我知道你能听到我！,,,SVM_8_Strange,,
Scripts/content/Story/svm.d:1189,Lästige Viecher!,可恶的东西！,,,SVM_8_DieMonster,,
Scripts/content/Story/svm.d:1190,Jetzt stirbst du. Nimm's nicht persönlich!,你马上要死了。不要带走它！,,,SVM_8_DieMortalEnemy,,
Scripts/content/Story/svm.d:1191,Du Wurm greifst MICH an! Na warte ...,你竟然袭击我！你等着．．．,,,SVM_8_NowWait,,
Scripts/content/Story/svm.d:1192,hab' ich dich nicht schon mal in den Staub getreten? Auf ein Neues ...,我没有把你打下地狱吗？再来一次．．．,,,SVM_8_YouStillNotHaveEnough,,
Scripts/content/Story/svm.d:1193,"Wer nicht hören will, muss fühlen!",如果你不听，你就必定不会好受！,,,SVM_8_YouAskedForIt,,
Scripts/content/Story/svm.d:1194,"Du wagst es, HIER rumzulaufen? Na warte!",你竟敢在这儿四处逛？等等！,,,SVM_8_NowWaitIntruder,,
Scripts/content/Story/svm.d:1195,Ich muss dir wohl auf die Flossen hauen!,我必须砸烂你的手！,,,SVM_8_IWillTeachYouRespectForForeignProperty,,
Scripts/content/Story/svm.d:1196,Das hättest du nicht klauen sollen!,你不应该偷它！,,,SVM_8_DirtyThief,,
Scripts/content/Story/svm.d:1197,Niemand vergreift sich ungestraft an meinen Jungs!,弄乱我东西的人没有一个会有好下场！,,,SVM_8_YouAttackedMyCharge,,
Scripts/content/Story/svm.d:1198,Einen von uns umzubringen war dein letzter Fehler!,杀我们的人会成为你最后犯的错误！,,,SVM_8_YouKilledOneOfUs,,
Scripts/content/Story/svm.d:1199,Aaarg,啊,,,SVM_8_Dead,,
Scripts/content/Story/svm.d:1200,Aargh,啊,,,SVM_8_Aargh_1,,
Scripts/content/Story/svm.d:1201,Aargh,啊,,,SVM_8_Aargh_2,,
Scripts/content/Story/svm.d:1202,Aargh,啊,,,SVM_8_Aargh_3,,
Scripts/content/Story/svm.d:1203,UUAAARRGGGHHH!!!,呜啊！！！,,,SVM_8_Berzerk,,
Scripts/content/Story/svm.d:1204,Das wird dir noch sehr Leid tun!,你为会此歉疚的！,,,SVM_8_YoullBeSorryForThis,,
Scripts/content/Story/svm.d:1205,Ganz ruhig. Alles in Ordnung!,放轻松。没有什么问题！,,,SVM_8_YesYes,,
Scripts/content/Story/svm.d:1206,Dieses Biest sehe ich mir lieber aus der Entfernung an!,我宁可在远处看一眼这个畜牲！,,,SVM_8_ShitWhatAMonster,,
Scripts/content/Story/svm.d:1207,Nichts wie weg!,快点，离开这儿！,,,SVM_8_Help,,
Scripts/content/Story/svm.d:1208,Wir sehen uns wieder!,我们会再见的！,,,SVM_8_WeWillMeetAgain,,
Scripts/content/Story/svm.d:1209,Noch einmal und du bist tot!,再那样做，你就没命了！,,,SVM_8_NeverTryThatAgain,,
Scripts/content/Story/svm.d:1210,Die Waffe gefällt mir!,我喜欢那种武器！,,,SVM_8_ITakeYourWeapon,,
Scripts/content/Story/svm.d:1211,Du hast bestimmt noch keine Erzsteuern an mich entrichtet!,我认为你没有付过矿石税给我！,,,SVM_8_ITookYourOre,,
Scripts/content/Story/svm.d:1212,"Klar, dass ein Verlierer wie du kein Erz hat!",当然，像你这样一个败者不会有矿石的！,,,SVM_8_ShitNoOre,,
Scripts/content/Story/svm.d:1213,Finger weg!,别碰！,,,SVM_8_HandsOff,,
Scripts/content/Story/svm.d:1214,Raus hier!,离开这里！,,,SVM_8_GetOutOfHere,,
Scripts/content/Story/svm.d:1215,"Hey, wie kommst DU hier rein?",嗨！你怎样到这儿的？,,,SVM_8_YouViolatedForbiddenTerritory,,
Scripts/content/Story/svm.d:1216,"Bist ein ganz Schlauer, was?",你是一个十分聪明的饭桶，不是吗？,,,SVM_8_YouWannaFoolMe,,
Scripts/content/Story/svm.d:1217,Hey du! Was schleichst du da rum.,嘿！你在这儿鬼鬼祟祟地做什么？,,,SVM_8_WhatsThisSupposedToBe,,
Scripts/content/Story/svm.d:1218,"Verschwinde, sonst ruf ich die Wachen!",走开，否则我叫守卫了！,,,SVM_8_WhyYouAreInHere,,
Scripts/content/Story/svm.d:1219,Was hast du da drinnen getrieben?,你一直在那儿做什么？,,,SVM_8_WhatDidYouInThere,,
Scripts/content/Story/svm.d:1220,Da hast du noch mal Glück gehabt.,你很幸运。,,,SVM_8_WiseMove,,
Scripts/content/Story/svm.d:1221,"Wachen, hierher!",守卫！这儿！,,,SVM_8_Alarm,,
Scripts/content/Story/svm.d:1222,ALARM!!! EINDRINGLING!!!,警告！！！小偷！！！,,,SVM_8_IntruderAlert,,
Scripts/content/Story/svm.d:1223,Hinter dir!,在你后面！,,,SVM_8_BehindYou,,
Scripts/content/Story/svm.d:1224,"Mal sehen, wer da kämpft!",让我们看看谁在那儿打仗！,,,SVM_8_TheresAFight,,
Scripts/content/Story/svm.d:1225,Fester!,用力！,,,SVM_8_HeyHeyHey,,
Scripts/content/Story/svm.d:1226,"Ja! Weiter, weiter!",对，就这样跟着来!,,,SVM_8_CheerFight,,
Scripts/content/Story/svm.d:1227,Gut so! Nicht nachlassen!,好！不要放松！,,,SVM_8_CheerFriend,,
Scripts/content/Story/svm.d:1228,Lass dir das nicht bieten! Hau ihm aufs Maul!,不要忍受了！给他点颜色看看！,,,SVM_8_Ooh,,
Scripts/content/Story/svm.d:1229,"Ja, gib's ihm. Der bewegt sich noch!",是的，给他。他还在动！,,,SVM_8_YeahWellDone,,
Scripts/content/Story/svm.d:1230,Lass dich hier nicht mehr blicken!,不要再出现在这儿！,,,SVM_8_RunCoward,,
Scripts/content/Story/svm.d:1231,Langweiliger Kampf!,讨厌的战斗！,,,SVM_8_HeDefeatedHim,,
Scripts/content/Story/svm.d:1232,Geschieht ihm recht!,他活该！,,,SVM_8_HeDeservedIt,,
Scripts/content/Story/svm.d:1233,Das war unnötig. du wirst die Folgen zu tragen haben.,那是不必的。但你必须承担后果。,,,SVM_8_HeKilledHim,,
Scripts/content/Story/svm.d:1234,War'n guter Kampf!,一场激烈的战斗！,,,SVM_8_ItWasAGoodFight,,
Scripts/content/Story/svm.d:1235,Gäääähn,呵,,,SVM_8_Awake,,
Scripts/content/Story/svm.d:1236,Hallo.,你好！,,,SVM_8_FriendlyGreetings,,
Scripts/content/Story/svm.d:1237,Für Gomez!,为了葛梅兹！,,,SVM_8_ALGreetings,,
Scripts/content/Story/svm.d:1238,Magie zu Ehren!,为了魔法的荣耀！,,,SVM_8_MageGreetings,,
Scripts/content/Story/svm.d:1239,Erwache!,醒醒！,,,SVM_8_SectGreetings,,
Scripts/content/Story/svm.d:1240,Da vorne ist er.,他在那儿。,,,SVM_8_ThereHeIs,,
Scripts/content/Story/svm.d:1241,Ich kann dir nichts beibringen. Du hast nicht genug Erfahrung.,我不能教你什么，因为你没有足够的经验。,,,SVM_8_NoLearnNoPoints,,
Scripts/content/Story/svm.d:1242,Du bist am Ende deiner Möglichkeiten. Du solltest etwas anderes lernen.,你已经无能为力了。你应该学习新的东西。,,,SVM_8_NoLearnOverMax,,
Scripts/content/Story/svm.d:1243,"Du musst erst fortgeschritten sein, bevor du Meister werden kannst!",在你成为大师之前，你必须努力提高自己的能力！,,,SVM_8_NoLearnYouAlreadyKnow,,
Scripts/content/Story/svm.d:1244,Du bist jetzt schon besser!,现在你很好！,,,SVM_8_NoLearnYoureBetter,,
Scripts/content/Story/svm.d:1245,Hey du!,嗨，就是你！,,,SVM_8_HeyYou,,
Scripts/content/Story/svm.d:1246,Nicht jetzt.,现在不。,,,SVM_8_NotNow,,
Scripts/content/Story/svm.d:1247,Was willst du?,你想做什么？,,,SVM_8_WhatDoYouWant,,
Scripts/content/Story/svm.d:1248,Kann ich was für dich tun?,我能帮你吗？,,,SVM_8_ISaidWhatDoYouWant,,
Scripts/content/Story/svm.d:1249,Kann ich da mal vorbei?,我可以从这儿过去吗？,,,SVM_8_MakeWay,,
Scripts/content/Story/svm.d:1250,Geh zur Seite!,让开！,,,SVM_8_OutOfMyWay,,
Scripts/content/Story/svm.d:1251,Soll ich's in dich reinprügeln? Weg da!,你想让我打碎你的脑袋吗？滚开！,,,SVM_8_YouDeafOrWhat,,
Scripts/content/Story/svm.d:1252,Willst du dich noch mal mit mir anlegen?,你又找我麻烦？,,,SVM_8_LookingForTroubleAgain,,
